{
  "schemaVersion": "1.0",
  "catalogueVersion": "1.0.0",
  "publishedAt": "2026-10-19T12:00:00.000Z",
  "review": {
    "state": "approved",
    "reviewedBy": "Daybreak baseline compatibility migration",
    "reviewedAt": "2026-10-19T12:00:00.000Z",
    "changeSummary": "Lossless migration of 43 embedded references; vendor provenance remains legacy/unverified, with original asserted verification dates."
  },
  "sources": [
    {
      "id": "source-0",
      "url": "https://adoptium.net/support/",
      "publisher": "Java",
      "authority": "official",
      "evidenceState": "legacy_unverified",
      "retrievedAt": null,
      "contentSha256": null,
      "repositoryRevision": null,
      "parserRevision": "embedded-reference-migration-v1",
      "localEvidencePath": null
    },
    {
      "id": "source-1",
      "url": "https://www.php.net/eol.php",
      "publisher": "PHP",
      "authority": "official",
      "evidenceState": "legacy_unverified",
      "retrievedAt": null,
      "contentSha256": null,
      "repositoryRevision": null,
      "parserRevision": "embedded-reference-migration-v1",
      "localEvidencePath": null
    },
    {
      "id": "source-2",
      "url": "https://www.php.net/supported-versions.php",
      "publisher": "PHP",
      "authority": "official",
      "evidenceState": "legacy_unverified",
      "retrievedAt": null,
      "contentSha256": null,
      "repositoryRevision": null,
      "parserRevision": "embedded-reference-migration-v1",
      "localEvidencePath": null
    },
    {
      "id": "source-3",
      "url": "https://go.dev/doc/devel/release",
      "publisher": "Go",
      "authority": "official",
      "evidenceState": "legacy_unverified",
      "retrievedAt": null,
      "contentSha256": null,
      "repositoryRevision": null,
      "parserRevision": "embedded-reference-migration-v1",
      "localEvidencePath": null
    },
    {
      "id": "source-4",
      "url": "https://containerd.io/releases/",
      "publisher": "containerd",
      "authority": "official",
      "evidenceState": "legacy_unverified",
      "retrievedAt": null,
      "contentSha256": null,
      "repositoryRevision": null,
      "parserRevision": "embedded-reference-migration-v1",
      "localEvidencePath": null
    },
    {
      "id": "source-5",
      "url": "https://ubuntu.com/about/release-cycle",
      "publisher": "Ubuntu",
      "authority": "official",
      "evidenceState": "legacy_unverified",
      "retrievedAt": null,
      "contentSha256": null,
      "repositoryRevision": null,
      "parserRevision": "embedded-reference-migration-v1",
      "localEvidencePath": null
    },
    {
      "id": "source-6",
      "url": "https://kubernetes.io/releases/patch-releases/",
      "publisher": "Kubernetes",
      "authority": "official",
      "evidenceState": "legacy_unverified",
      "retrievedAt": null,
      "contentSha256": null,
      "repositoryRevision": null,
      "parserRevision": "embedded-reference-migration-v1",
      "localEvidencePath": null
    },
    {
      "id": "source-7",
      "url": "https://github.com/nodejs/Release",
      "publisher": "Node.js",
      "authority": "official",
      "evidenceState": "legacy_unverified",
      "retrievedAt": null,
      "contentSha256": null,
      "repositoryRevision": null,
      "parserRevision": "embedded-reference-migration-v1",
      "localEvidencePath": null
    },
    {
      "id": "source-8",
      "url": "https://devguide.python.org/versions/",
      "publisher": "Python",
      "authority": "official",
      "evidenceState": "legacy_unverified",
      "retrievedAt": null,
      "contentSha256": null,
      "repositoryRevision": null,
      "parserRevision": "embedded-reference-migration-v1",
      "localEvidencePath": null
    }
  ],
  "entries": [
    {
      "id": "adoptium:8",
      "vendorId": "adoptium",
      "productId": "Java",
      "aliases": [],
      "scope": {
        "edition": "Eclipse Adoptium",
        "distribution": null,
        "os": null,
        "architecture": null,
        "editionRequirement": "required",
        "supportChannel": "standard_upstream",
        "entitlement": "not_required"
      },
      "version": {
        "scheme": "java",
        "kind": "major",
        "expression": "8"
      },
      "evaluationMilestone": "end_of_availability",
      "milestones": [
        {
          "kind": "end_of_availability",
          "meaning": "minimum_bound",
          "date": {
            "precision": "month",
            "value": "2030-12"
          },
          "scope": "Disponibilité de builds Temurin annoncée au moins jusqu’à cette date ; SLA commercial et niveau de patch non certifiés",
          "sourceIds": ["source-0"],
          "derivation": null,
          "uncertainty": {
            "state": "minimum_bound",
            "explanation": "Minimum availability; not an EOS promise"
          }
        }
      ],
      "verifiedAt": "2026-10-08T00:00:00.000Z",
      "verificationState": "legacy_record",
      "sourceIds": ["source-0"],
      "uncertainty": {
        "state": "legacy_provenance",
        "explanation": "Original verification assertion retained; official source content was not archived"
      }
    },
    {
      "id": "adoptium:11",
      "vendorId": "adoptium",
      "productId": "Java",
      "aliases": [],
      "scope": {
        "edition": "Eclipse Adoptium",
        "distribution": null,
        "os": null,
        "architecture": null,
        "editionRequirement": "required",
        "supportChannel": "standard_upstream",
        "entitlement": "not_required"
      },
      "version": {
        "scheme": "java",
        "kind": "major",
        "expression": "11"
      },
      "evaluationMilestone": "end_of_availability",
      "milestones": [
        {
          "kind": "end_of_availability",
          "meaning": "minimum_bound",
          "date": {
            "precision": "month",
            "value": "2027-10"
          },
          "scope": "Disponibilité de builds Temurin annoncée au moins jusqu’à cette date ; SLA commercial et niveau de patch non certifiés",
          "sourceIds": ["source-0"],
          "derivation": null,
          "uncertainty": {
            "state": "minimum_bound",
            "explanation": "Minimum availability; not an EOS promise"
          }
        }
      ],
      "verifiedAt": "2026-10-08T00:00:00.000Z",
      "verificationState": "legacy_record",
      "sourceIds": ["source-0"],
      "uncertainty": {
        "state": "legacy_provenance",
        "explanation": "Original verification assertion retained; official source content was not archived"
      }
    },
    {
      "id": "adoptium:17",
      "vendorId": "adoptium",
      "productId": "Java",
      "aliases": [],
      "scope": {
        "edition": "Eclipse Adoptium",
        "distribution": null,
        "os": null,
        "architecture": null,
        "editionRequirement": "required",
        "supportChannel": "standard_upstream",
        "entitlement": "not_required"
      },
      "version": {
        "scheme": "java",
        "kind": "major",
        "expression": "17"
      },
      "evaluationMilestone": "end_of_availability",
      "milestones": [
        {
          "kind": "end_of_availability",
          "meaning": "minimum_bound",
          "date": {
            "precision": "month",
            "value": "2027-10"
          },
          "scope": "Disponibilité de builds Temurin annoncée au moins jusqu’à cette date ; SLA commercial et niveau de patch non certifiés",
          "sourceIds": ["source-0"],
          "derivation": null,
          "uncertainty": {
            "state": "minimum_bound",
            "explanation": "Minimum availability; not an EOS promise"
          }
        }
      ],
      "verifiedAt": "2026-10-08T00:00:00.000Z",
      "verificationState": "legacy_record",
      "sourceIds": ["source-0"],
      "uncertainty": {
        "state": "legacy_provenance",
        "explanation": "Original verification assertion retained; official source content was not archived"
      }
    },
    {
      "id": "adoptium:21",
      "vendorId": "adoptium",
      "productId": "Java",
      "aliases": [],
      "scope": {
        "edition": "Eclipse Adoptium",
        "distribution": null,
        "os": null,
        "architecture": null,
        "editionRequirement": "required",
        "supportChannel": "standard_upstream",
        "entitlement": "not_required"
      },
      "version": {
        "scheme": "java",
        "kind": "major",
        "expression": "21"
      },
      "evaluationMilestone": "end_of_availability",
      "milestones": [
        {
          "kind": "end_of_availability",
          "meaning": "minimum_bound",
          "date": {
            "precision": "month",
            "value": "2029-12"
          },
          "scope": "Disponibilité de builds Temurin annoncée au moins jusqu’à cette date ; SLA commercial et niveau de patch non certifiés",
          "sourceIds": ["source-0"],
          "derivation": null,
          "uncertainty": {
            "state": "minimum_bound",
            "explanation": "Minimum availability; not an EOS promise"
          }
        }
      ],
      "verifiedAt": "2026-10-08T00:00:00.000Z",
      "verificationState": "legacy_record",
      "sourceIds": ["source-0"],
      "uncertainty": {
        "state": "legacy_provenance",
        "explanation": "Original verification assertion retained; official source content was not archived"
      }
    },
    {
      "id": "adoptium:25",
      "vendorId": "adoptium",
      "productId": "Java",
      "aliases": [],
      "scope": {
        "edition": "Eclipse Adoptium",
        "distribution": null,
        "os": null,
        "architecture": null,
        "editionRequirement": "required",
        "supportChannel": "standard_upstream",
        "entitlement": "not_required"
      },
      "version": {
        "scheme": "java",
        "kind": "major",